Symbol,Name,Last Sale,Net Change,% Change,Market Cap,Country,IPO Year,Volume,Sector,Industry
DD,DuPont de Nemours Inc. Common Stock,$67.78,-7.47,-9.927%,32394232587.00,United States,2017,4637179,Industrials,Major Chemicals
DDD,3D Systems Corporation Common Stock,$1.92,-0.18,-8.571%,260233862.00,United States,,2961473,Technology,Computer Software: Prepackaged Software
DDL,Dingdong (Cayman) Limited American Depositary Shares (each two representing three Ordinary Shares),$2.57,-0.21,-7.554%,464758800.00,Cayman Islands,2021,686610,Consumer Discretionary,Catalog/Specialty Distribution
DDS,Dillard's Inc. Common Stock,$320.66,-43.38,-11.916%,5099989558.00,United States,,188116,Consumer Discretionary,Department/Specialty Retail Stores
DDT,Dillard's Capital Trust I,$25.67,-0.20,-0.773%,408272725.00,United States,,30581,Consumer Discretionary,Department/Specialty Retail Stores
DE,Deere & Company Common Stock,$447.45,-23.45,-4.98%,121444161636.00,United States,,2287976,Industrials,Industrial Machinery/Components
DEA,Easterly Government Properties Inc. Common Stock,$10.25,-0.34,-3.211%,1106698230.00,United States,2015,1392614,Real Estate,Real Estate Investment Trusts
DEC,Diversified Energy Company plc Ordinary Shares,$12.97,-1.05,-7.489%,775553368.00,,,465439,,
DECK,Deckers Outdoor Corporation Common Stock,$100.88,-17.10,-14.494%,15310924702.00,United States,1993,8699730,Consumer Discretionary,Shoe Manufacturing
DEI,Douglas Emmett Inc. Common Stock,$14.59,-1.70,-10.436%,2443042247.00,United States,2006,2057799,Real Estate,Real Estate Investment Trusts
DELL,Dell Technologies Inc. Class C Common Stock ,$77.23,-18.10,-18.987%,53894246606.00,United States,2018,30868525,Technology,Computer Manufacturing
DEO,Diageo plc Common Stock,$108.01,1.53,1.437%,60087891087.00,United Kingdom,,2560894,Consumer Staples,Beverages (Production/Distribution)
DESP,Despegar.com Corp. Ordinary Shares,$18.91,-0.08,-0.421%,1362545092.00,Argentina,2017,2331350,Consumer Discretionary,Transportation Services
DFH,Dream Finders Homes Inc. Class A Common Stock,$21.31,-1.46,-6.412%,1991142491.00,United States,2022,604277,Consumer Discretionary,Homebuilding
DFIN,Donnelley Financial Solutions Inc. Common Stock ,$41.89,-2.94,-6.558%,1198437168.00,United States,2016,405261,Consumer Discretionary,Other Consumer Services
DFP,Flaherty & Crumrine Dynamic Preferred and Income Fund Inc. Common Stock,$19.90,-0.35,-1.728%,0.00,,2013,96237,Finance,Investment Managers
DFS,Discover Financial Services Common Stock,$161.26,-14.68,-8.344%,40573681843.00,United States,,6114672,Finance,Finance: Consumer Services
DG,Dollar General Corporation Common Stock,$94.41,4.21,4.667%,20765203634.00,United States,2009,11232390,Consumer Discretionary,Department/Specialty Retail Stores
DGX,Quest Diagnostics Incorporated Common Stock,$170.63,2.67,1.59%,18936187913.00,United States,,1828614,Health Care,Medical Specialities
DHF,BNY Mellon High Yield Strategies Fund Common Stock,$2.51,-0.03,-1.181%,0.00,United States,1998,433425,Finance,Finance Companies
DHI,D.R. Horton Inc. Common Stock,$122.31,-5.66,-4.423%,38542631263.00,United States,,4161386,Consumer Discretionary,Homebuilding
DHR,Danaher Corporation Common Stock,$197.90,-7.26,-3.539%,141441079711.00,United States,,5413397,Industrials,Industrial Machinery/Components
DHT,DHT Holdings Inc.,$10.00,-0.37,-3.568%,1605579780.00,Jersey,2005,2681936,Consumer Discretionary,Marine Transportation
DHX,DHI Group Inc. Common Stock,$1.44,0.09,6.667%,70448070.00,United States,2007,209662,Consumer Discretionary,Business Services
DIAX,Nuveen Dow 30SM Dynamic Overwrite Fund Common Shares of Beneficial Interest,$14.00,-0.44,-3.047%,0.00,,2014,186881,Finance,Finance Companies
DIN,Dine Brands Global Inc. Common Stock,$21.74,-2.08,-8.732%,331617329.00,United States,,2113840,Consumer Discretionary,Restaurants
DINO,HF Sinclair Corporation Common Stock,$29.26,-4.35,-12.943%,5512798856.00,United States,1960,4271895,Energy,Natural Gas Distribution
DIS,Walt Disney Company (The) Common Stock,$88.84,-9.04,-9.236%,160603962767.00,United States,,19353389,Consumer Discretionary,Services-Misc. Amusement & Recreation
DK,Delek US Holdings Inc. Common Stock,$12.91,-2.57,-16.602%,807045825.00,United States,2017,1908103,Energy,Integrated oil Companies
DKL,Delek Logistics Partners L.P. Common Units representing Limited Partner Interests,$42.53,-1.09,-2.499%,2282479753.00,United States,2012,155346,Energy,Natural Gas Distribution
DKS,Dick's Sporting Goods Inc Common Stock,$184.97,-26.35,-12.469%,14770906239.00,United States,2002,4149616,Consumer Discretionary,Other Specialty Stores
DLB,Dolby Laboratories Common Stock,$77.64,-3.57,-4.396%,7482716258.00,United States,2005,547954,Miscellaneous,Multi-Sector Companies
DLNG,Dynagas LNG Partners LP Common Units,$3.70,-0.10,-2.632%,136299760.00,Greece,,96286,Consumer Discretionary,Marine Transportation
DLNG^A,Dynagas LNG Partners LP 9.00% Series A Cumulative Redeemable Preferred Units,$25.50,-0.0638,-0.25%,,Greece,,5239,,
DLNG^B,Dynagas LNG Partners LP 8.75% Series B Fixed to Floating Rate Cumulative Redeemable Perpetual Preferred Units liquidation preference $25.00 per Uni,$25.46,-0.175,-0.683%,,Greece,,5075,,
DLR,Digital Realty Trust Inc. Common Stock,$141.09,-7.59,-5.105%,47497136527.00,United States,2004,3789456,Real Estate,Real Estate Investment Trusts
DLR^J,Digital Realty Trust Inc. 5.250% Series J Cumulative Redeemable Preferred Stock,$20.59,-0.24,-1.152%,,United States,,12452,,
DLR^K,Digital Realty Trust Inc. 5.850% Series K Cumulative Redeemable Preferred Stock par value $0.01 per share,$23.03,-0.14,-0.604%,,United States,,12906,,
DLR^L,Digital Realty Trust Inc. 5.200% Series L Cumulative Redeemable Preferred Stock,$20.09,-0.21,-1.034%,,United States,,71063,,
DLX,Deluxe Corporation Common Stock,$15.19,-1.06,-6.523%,674903898.00,United States,,454122,Consumer Discretionary,Publishing
DLY,DoubleLine Yield Opportunities Fund Common Shares of Beneficial Interest,$15.83,-0.27,-1.677%,758981682.00,United States,2020,339807,Finance,Investment Managers
DMA,Destra Multi-Alternative Fund Common Stock,$8.18,-0.21,-2.503%,0.00,,2022,19569,Finance,Trusts Except Educational Religious and Charitable
DMB,BNY Mellon Municipal Bond Infrastructure Fund Inc. Common Stock,$10.68,0.01,0.094%,0.00,,2013,48987,Finance,Trusts Except Educational Religious and Charitable
DMO,Western Asset Mortgage Opportunity Fund Inc. Common Stock,$11.70,-0.09,-0.763%,0.00,United States,2010,51590,Finance,Trusts Except Educational Religious and Charitable
DNA,Ginkgo Bioworks Holdings Inc. Class A Common Stock,$5.70,-0.26,-4.362%,330791520.00,United States,2021,1451357,Health Care,Biotechnology: Biological Products (No Diagnostic Substances)
DNB,Dun & Bradstreet Holdings Inc. Common Stock,$8.94,-0.05,-0.556%,3947156339.00,United States,2020,39551862,Finance,Finance: Consumer Services
DNOW,DNOW Inc. Common Stock,$16.04,-1.27,-7.337%,1695226056.00,United States,2014,964845,Industrials,Metal Fabrications
DNP,DNP Select Income Fund Inc. Common Stock,$9.58,-0.20,-2.045%,0.00,United States,1987,892499,Finance,Investment Managers
DOC,Healthpeak Properties Inc. Common Stock,$19.46,-0.60,-2.991%,13613527836.00,United States,,4953550,Real Estate,Real Estate Investment Trusts
DOCN,DigitalOcean Holdings Inc. Common Stock,$31.23,-3.96,-11.253%,2875277363.00,United States,2021,1602303,Technology,Computer Software: Programming Data Processing
DOCS,Doximity Inc. Class A Common Stock,$54.58,-3.37,-5.815%,10241233245.00,United States,2021,3049423,Technology,EDP Services
DOLE,Dole plc Ordinary Shares,$14.75,0.09,0.614%,1403286002.00,Ireland,2021,526787,Consumer Staples,Farming/Seeds/Milling
DOUG,Douglas Elliman Inc. Common Stock,$1.62,-0.06,-3.571%,143755298.00,United States,2021,893280,Finance,Real Estate
DOV,Dover Corporation Common Stock,$162.73,-16.29,-9.10%,22330690807.00,United States,,1320729,Industrials,Industrial Machinery/Components
DOW,Dow Inc. Common Stock ,$31.46,-3.43,-9.831%,22142552549.00,United States,2019,18080863,Industrials,Major Chemicals
DPG,Duff & Phelps Utility and Infrastructure Fund Inc.,$12.11,-0.18,-1.465%,0.00,United States,2011,187616,Finance,Trusts Except Educational Religious and Charitable
DQ,DAQO New Energy Corp. American Depositary Shares each representing five ordinary shares,$16.62,-1.53,-8.43%,1097043836.00,China,2010,1680263,Technology,Semiconductors
DRD,DRDGOLD Limited American Depositary Shares,$15.65,-0.01,-0.064%,1353081331.00,South Africa,,547510,Basic Materials,Precious Metals
DRH,Diamondrock Hospitality Company Common Stock,$7.23,-0.65,-8.249%,1504487540.00,United States,2005,4106275,Real Estate,Real Estate Investment Trusts
DRH^A,Diamondrock Hospitality Company 8.250% Series A Cumulative Redeemable Preferred Stock,$24.33,-0.47,-1.895%,,United States,,44317,,
DRI,Darden Restaurants Inc. Common Stock,$200.68,-8.89,-4.242%,23484827047.00,United States,,2082806,Consumer Discretionary,Restaurants
DSL,DoubleLine Income Solutions Fund Common Shares of Beneficial Interests,$12.35,-0.17,-1.358%,1259660826.00,United States,2013,622545,Finance,Trusts Except Educational Religious and Charitable
DSM,BNY Mellon Strategic Municipal Bond Fund Inc. Common Stock,$5.85,-0.01,-0.171%,0.00,United States,1989,83149,Finance,Investment Managers
DSU,Blackrock Debt Strategies Fund Inc. Common Stock,$10.29,-0.15,-1.437%,0.00,United States,1998,283079,Finance,Finance Companies
DSX,Diana Shipping inc. common stock,$1.50,-0.11,-6.832%,173651792.00,Greece,2005,548175,Consumer Discretionary,Marine Transportation
DSX^B,Diana Shipping Inc. Perpetual Preferred Shares Series B (Marshall Islands),$26.00,0.00,0.00%,,Greece,,26,,
DT,Dynatrace Inc. Common Stock,$45.66,-2.71,-5.603%,13668322507.00,United States,2019,2399189,Technology,Computer Software: Prepackaged Software
DTB,DTE Energy Company 2020 Series G 4.375% Junior Subordinated Debentures due 2080,$17.62,-0.2277,-1.276%,3651610912.00,United States,2020,16176,Utilities,Electric Utilities: Central
DTC,Solo Brands Inc. Class A Common Stock,$0.1425,-0.0175,-10.938%,13149688.00,United States,2021,1169546,Consumer Discretionary,Recreational Games/Products/Toys
DTE,DTE Energy Company Common Stock,$139.49,1.49,1.08%,28908240981.00,United States,,1946789,Utilities,Electric Utilities: Central
DTF,DTF Tax-Free Income 2028 Term Fund Inc. Common Stock,$11.25,-0.02,-0.177%,79082629.00,United States,1991,2015,Finance,Investment Managers
DTG,DTE Energy Company 2021 Series E 4.375% Junior Subordinated Debentures,$17.74,-0.19,-1.06%,3676479999.00,United States,2021,23672,Utilities,Electric Utilities: Central
DTM,DT Midstream Inc. Common Stock ,$94.61,-4.89,-4.915%,9589530902.00,United States,2021,1146761,Utilities,Natural Gas Distribution
DTW,DTE Energy Company 2017 Series E 5.25% Junior Subordinated Debentures due 2077,$21.36,-0.3094,-1.428%,4426697450.00,United States,2017,29335,Utilities,Electric Utilities: Central
DUK,Duke Energy Corporation (Holding Company) Common Stock,$124.05,3.66,3.04%,96319988042.00,United States,,7427136,Utilities,Power Generation
DUK^A,Duke Energy Corporation Depositary Shares each representing a 1/1000th interest in a share of 5.75% Series A Cumulative Redeemable Perpetual Preferred Stock,$24.61,0.05,0.204%,,United States,,165664,,
DUKB,Duke Energy Corporation 5.625% Junior Subordinated Debentures due 2078,$23.78,-0.08,-0.335%,18464242770.00,United States,2018,32708,Utilities,Power Generation
DV,DoubleVerify Holdings Inc. Common Stock,$12.64,-0.75,-5.601%,2098388204.00,United States,2021,3112447,Technology,Computer Software: Programming Data Processing
DVA,DaVita Inc. Common Stock,$153.73,-0.56,-0.363%,12298400000.00,United States,,882474,Health Care,Misc Health and Biotechnology Services
DVN,Devon Energy Corporation Common Stock,$33.16,-4.76,-12.553%,21520840000.00,United States,1985,16227442,Energy,Oil & Gas Production
DX,Dynex Capital Inc. Common Stock,$12.70,-0.11,-0.859%,1148949099.00,United States,,5637732,Real Estate,Real Estate Investment Trusts
DX^C,Dynex Capital Inc. 6.900% Series C Fixed-to-Floating Rate Cumulative Redeemable Preferred Stock,$25.30,-0.028,-0.111%,,United States,,39925,,
DXC,DXC Technology Company Common Stock ,$16.41,-1.22,-6.92%,2971006886.00,United States,,1504766,Technology,EDP Services
DXYZ,Destiny Tech100 Inc. Common Stock,$37.00,-3.00,-7.50%,0.00,,2024,499832,,
DY,Dycom Industries Inc. Common Stock,$147.94,-10.01,-6.337%,4287173676.00,United States,,460760,Industrials,Water Sewer Pipeline Comm & Power Line Construction
E,ENI S.p.A. Common Stock,$30.07,-1.07,-3.436%,50757226236.00,Italy,,288674,Energy,Oil & Gas Production
EAF,GrafTech International Ltd. Common Stock,$0.7821,-0.0992,-11.256%,201205948.00,United States,2018,2942058,Energy,Industrial Machinery/Components
EAI,Entergy Arkansas LLC First Mortgage Bonds 4.875% Series Due September 1 2066,$20.65,-0.14,-0.673%,8888019777.00,United States,2016,19312,Utilities,Electric Utilities: Central
EARN,Ellington Credit Company Common Shares of Beneficial Interest,$5.11,-0.16,-3.036%,191927486.00,United States,2013,1907337,Real Estate,Real Estate Investment Trusts
EAT,Brinker International Inc. Common Stock,$138.70,-16.55,-10.66%,6159231066.00,United States,,2563528,Consumer Discretionary,Restaurants
EB,Eventbrite Inc. Class A Common Stock,$2.02,-0.10,-4.717%,191151473.00,United States,2018,1063476,Technology,Computer Software: Programming Data Processing
EBF,Ennis Inc. Common Stock,$19.87,-0.35,-1.731%,516870422.00,United States,,139278,Consumer Discretionary,Office Equipment/Supplies/Services
EBR,Centrais Electricas Brasileiras S A American Depositary Shares (Each representing one Common Share),$7.33,0.21,2.949%,16461818687.00,Brazil,2016,1444133,Utilities,Electric Utilities: Central
EBS,Emergent BioSolutions Inc. Common Stock,$4.83,-0.34,-6.576%,262447836.00,United States,2006,1585424,Health Care,Biotechnology: Pharmaceutical Preparations
EC,Ecopetrol S.A. American Depositary Shares,$9.55,-1.08,-10.16%,19633221719.00,Colombia,,3752560,Energy,Oil & Gas Production
ECAT,BlackRock ESG Capital Allocation Term Trust Common Shares of Beneficial Interest,$15.45,-0.52,-3.256%,1670685750.00,United States,2021,557638,Finance,Trusts Except Educational Religious and Charitable
ECC           ,Eagle Point Credit Company Inc. Common Stock,$7.74,-0.57,-6.859%,469527936.00,United States,2014,2216327,Finance,Trusts Except Educational Religious and Charitable
ECC^D,Eagle Point Credit Company Inc. 6.75% Series D Preferred Stock,$19.75,-0.165,-0.829%,,United States,,15855,,
ECCC,Eagle Point Credit Company Inc. 6.50% Series C Term Preferred Stock due 2031,$23.31,-0.07,-0.299%,1414043434.00,United States,,1531,Finance,Trusts Except Educational Religious and Charitable
ECCF,Eagle Point Credit Company Inc. 8.00% Series F Term Preferred Stock due 2029,$24.85,-0.05,-0.201%,27053519776.00,United States,,1737,,
ECCU,Eagle Point Credit Company Inc. 7.75% Notes due 2030,$24.38,-0.06,-0.245%,0.00,United States,2024,10753,,
ECCV,Eagle Point Credit Company Inc. 5.375% Notes due 2029,$22.9076,-0.2623,-1.132%,1389632835.00,United States,2022,649,Finance,Trusts Except Educational Religious and Charitable
ECCW,Eagle Point Credit Company Inc. 6.75% Notes due 2031,$23.54,0.00,0.00%,1427995815.00,United States,2021,126,Finance,Trusts Except Educational Religious and Charitable
ECCX,Eagle Point Credit Company Inc. 6.6875% Notes due 2028,$24.80,0.00,0.00%,1504430595.00,United States,2022,422,Finance,Trusts Except Educational Religious and Charitable
ECG,Everus Construction Group Inc. Common Stock,$35.31,-3.06,-7.975%,1800782741.00,United States,2024,803077,Consumer Discretionary,Homebuilding
ECL,Ecolab Inc. Common Stock,$250.24,-3.42,-1.348%,70817183794.00,United States,,1610859,Consumer Discretionary,Package Goods/Cosmetics
ECO,Okeanis Eco Tankers Corp. Common Stock,$20.82,-0.89,-4.099%,670281329.00,,,224686,Consumer Discretionary,Marine Transportation
ECVT,Ecovyst Inc. Common Stock,$5.92,-0.54,-8.359%,694815203.00,United States,2017,1250880,Industrials,Major Chemicals
ED,Consolidated Edison Inc. Common Stock,$112.72,3.14,2.865%,39081335948.00,United States,,4175537,Utilities,Power Generation
EDD,Morgan Stanley Emerging Markets Domestic Debt Fund Inc. Common Stock,$4.70,-0.04,-0.844%,0.00,United States,2007,210410,Finance,Finance Companies
EDF,Virtus Stone Harbor Emerging Markets Income Fund Common Shares of Beneficial Interest,$4.885,-0.075,-1.512%,0.00,United States,2010,114441,Finance,Investment Managers
EDN,Empresa Distribuidora Y Comercializadora Norte S.A. (Edenor) American Depositary Shares,$29.72,-0.58,-1.914%,1346992279.00,Argentina,2007,106195,Utilities,Electric Utilities: Central
EDU,New Oriental Education & Technology Group Inc. Sponsored ADR representing 10 Ordinary Share (Cayman Islands),$47.79,-0.80,-1.646%,7815042929.00,China,2006,1355654,Real Estate,Other Consumer Services
EE,Excelerate Energy Inc. Class A Common Stock,$25.90,-0.82,-3.069%,2742575191.00,United States,2022,1080778,Utilities,Oil/Gas Transmission
EEA,The European Equity Fund Inc. Common Stock,$9.03,-0.1037,-1.135%,0.00,United States,,24650,Finance,Trusts Except Educational Religious and Charitable
EEX,Emerald Holding Inc. Common Stock,$3.81,-0.15,-3.788%,762177828.00,United States,2017,163707,Consumer Discretionary,Business Services
EFC,Ellington Financial Inc. Common Stock ,$13.08,-0.11,-0.834%,1186074675.00,United States,2010,1389273,Finance,Real Estate
EFC^A,Ellington Financial Inc. 6.750% Series A Fixed-to-Floating Rate Cumulative Redeemable Preferred Stock,$24.99,0.011,0.044%,,United States,,31532,,
EFC^B,Ellington Financial Inc. 6.250% Series B Fixed-Rate Reset Cumulative Redeemable Preferred Stock,$22.77,-0.13,-0.568%,,United States,,8672,,
EFC^C,Ellington Financial Inc. 8.625% Series C Fixed-Rate Reset Cumulative Redeemable Preferred Stock,$25.03,-0.1444,-0.574%,,United States,,1577,,
EFC^D,Ellington Financial Inc. 7.00% Series D Cumulative Perpetual Redeemable Preferred Stock,$23.3382,0.2482,1.075%,,United States,,2515,,
EFR,Eaton Vance Senior Floating-Rate Fund Common Shares of Beneficial Interest,$11.90,-0.22,-1.815%,0.00,United States,2003,187111,Finance,Trusts Except Educational Religious and Charitable
EFT,Eaton Vance Floating Rate Income Trust Common Shares of Beneficial Interest,$12.16,-0.24,-1.935%,353739446.00,United States,2004,165710,Finance,Finance Companies
EFX,Equifax Inc. Common Stock,$231.80,-15.77,-6.37%,28748725648.00,United States,,1281369,Finance,Finance: Consumer Services
EFXT,Enerflex Ltd Common Shares,$7.53,-0.63,-7.721%,934057427.00,Canada,2022,463991,Industrials,Industrial Machinery/Components
EG,Everest Group Ltd. Common Stock,$361.76,-3.58,-0.98%,15531838931.00,Bermuda,,337532,Finance,Property-Casualty Insurers
EGY,VAALCO Energy Inc.  Common Stock,$3.45,-0.35,-9.211%,357913912.00,United States,,1720555,Energy,Oil & Gas Production
EHAB,Enhabit Inc. Common Stock,$8.51,-0.29,-3.295%,429584383.00,United States,2022,229513,Health Care,Medical/Nursing Services
EHC,Encompass Health Corporation Common Stock,$101.87,-0.21,-0.206%,10259236628.00,United States,,1014531,Health Care,Hospital/Nursing Management
EHI,Western Asset Global High Income Fund Inc Common Stock,$6.56,-0.07,-1.056%,0.00,United States,2003,130210,Finance,Investment Managers
EIC,Eagle Point Income Company Inc. Common Stock,$14.835,-0.355,-2.337%,132151782.00,,2019,300895,Finance,Finance/Investors Services
EICA,Eagle Point Income Company Inc. 5.00% Series A Term Preferred Stock due 2026,$24.1833,-0.0267,-0.11%,215427448.00,,2021,3796,Finance,Finance/Investors Services
EICB,Eagle Point Income Company Inc. 7.75% Series B Term Preferred Stock Due 2028,$24.86,-0.08,-0.321%,0.00,,,2426,,
EICC,Eagle Point Income Company Inc. 8.00% Series C Term Preferred Stock due 2029,$25.0146,-0.0654,-0.261%,0.00,,,34986,,
EIG,Employers Holdings Inc Common Stock,$51.35,0.31,0.607%,1250743093.00,United States,2007,194838,Finance,Property-Casualty Insurers
EIIA,Eagle Point Institutional Income Fund 8.125% Series A Term Preferred Shares Due 2029,$24.95,-0.06,-0.24%,0.00,,2024,13771,,
EIX,Edison International Common Stock,$58.38,-1.54,-2.57%,22477673448.00,United States,,3829179,Utilities,Electric Utilities: Central
EL,Estee Lauder Companies Inc. (The) Common Stock,$58.19,-10.57,-15.372%,20931841745.00,United States,1995,11321469,Consumer Discretionary,Package Goods/Cosmetics
ELAN,Elanco Animal Health Incorporated Common Stock,$9.72,-1.05,-9.749%,4807647497.00,United States,2018,8760275,Health Care,Biotechnology: Pharmaceutical Preparations
ELC,Entergy Louisiana Inc. Collateral Trust Mortgage Bonds 4.875 % Series due September 1 2066,$20.48,-0.07,-0.341%,4367105065.00,United States,2016,65962,Utilities,Electric Utilities: Central
ELF,e.l.f. Beauty Inc. Common Stock,$55.02,-12.87,-18.957%,3103051412.00,United States,2016,6366757,Consumer Discretionary,Package Goods/Cosmetics
ELME,Elme Communities Common Stock,$16.66,-0.55,-3.196%,1466568005.00,United States,2000,789641,Real Estate,Real Estate Investment Trusts
ELP,Companhia Paranaense de Energia (COPEL) American Depositary Shares (each representing one Unit consisting one Common Share and four non-voting Class B Preferred Shares),$7.71,0.30,4.049%,2506419421.00,Brazil,2021,145581,Utilities,Electric Utilities: Central
ELPC,Companhia Paranaense de Energia (COPEL) American Depositary Shares (each representing four (4) Common Shares),$6.93,0.17,2.515%,2252851697.00,Brazil,2023,9991,Utilities,Electric Utilities: Central
ELS,Equity Lifestyle Properties Inc. Common Stock,$68.02,1.36,2.04%,13001537949.00,United States,,3068872,Real Estate,Real Estate Investment Trusts
ELV,Elevance Health Inc. Common Stock,$452.69,23.36,5.441%,102919918483.00,United States,,3314862,Health Care,Medical Specialities
EMD,Western Asset Emerging Markets Debt Fund Inc Common Stock,$9.68,-0.18,-1.826%,0.00,United States,,303543,Finance,Finance/Investors Services
EME,EMCOR Group Inc. Common Stock,$354.54,-30.41,-7.90%,16121863049.00,United States,,491219,Industrials,Engineering & Construction
EMF,Templeton Emerging Markets Fund Common Stock,$12.66,-0.27,-2.088%,0.00,United States,1987,21959,Finance,Finance/Investors Services
EMN,Eastman Chemical Company Common Stock,$79.98,-8.31,-9.412%,9211167192.00,United States,,1555500,Industrials,Major Chemicals
EMO,ClearBridge Energy Midstream Opportunity Fund Inc. Common Stock,$48.51,-2.10,-4.149%,0.00,United States,2011,52599,Finance,Investment Managers
EMP,Entergy Mississippi LLC First Mortgage Bonds 4.90% Series Due October 1 2066,$20.41,-0.15,-0.73%,8784720758.00,United States,2016,21323,Utilities,Electric Utilities: Central
EMR,Emerson Electric Company Common Stock,$101.89,-9.65,-8.652%,57455771000.00,United States,,3730368,Technology,Consumer Electronics/Appliances
ENB,Enbridge Inc Common Stock,$45.34,0.20,0.443%,98750520000.00,Canada,,5855088,Energy,Natural Gas Distribution
ENFN,Enfusion Inc. Class A Common Stock,$11.00,-0.14,-1.257%,1419009240.00,United States,2021,1542378,Technology,Computer Software: Prepackaged Software
ENFY,Enlightify Inc. Common Stock,$1.09,0.0183,1.708%,15747838.00,China,,5744,Industrials,Agricultural Chemicals
ENIC,Enel Chile S.A. American Depositary Shares (Each representing 50 shares of Common Stock),$3.35,0.00,0.00%,4634159332.00,Chile,2016,706018,Utilities,Electric Utilities: Central
ENJ,Entergy New Orleans LLC First Mortgage Bonds 5.0% Series due December 1 2052,$20.8972,-0.1278,-0.608%,8994417767.00,United States,,2315,Utilities,Power Generation
ENO,Entergy New Orleans LLC First Mortgage Bonds 5.50% Series due April 1 2066,$21.53,-0.18,-0.829%,4603778114.00,United States,2016,17008,Utilities,Power Generation
ENOV,Enovis Corporation Common Stock,$33.79,-3.19,-8.626%,1924794638.00,United States,,1327111,Health Care,Industrial Specialties
ENR,Energizer Holdings Inc. Common Stock,$29.35,-0.62,-2.069%,2118833322.00,United States,2015,671380,Miscellaneous,Industrial Machinery/Components
ENS,EnerSys Common Stock,$83.22,-9.79,-10.526%,3281238522.00,United States,2004,498292,Technology,Industrial Machinery/Components
ENVA,Enova International Inc. Common Stock,$92.16,-11.51,-11.103%,2377141309.00,United States,2014,336020,Finance,Finance: Consumer Services
ENZ,Enzo Biochem Inc. Common Stock ($0.01 Par Value),$0.3186,-0.0139,-4.18%,16695533.00,United States,1988,346154,Health Care,Medical Specialities
EOD,Allspring Global Dividend Opportunity Fund Common Shares of Beneficial Interest,$4.90,-0.11,-2.196%,0.00,United States,2007,88547,Finance,Investment Managers
EOG,EOG Resources Inc. Common Stock,$119.89,-10.08,-7.756%,66410227704.00,United States,,5530585,Energy,Oil & Gas Production
EOI,Eaton Vance Enhance Equity Income Fund Eaton Vance Enhanced Equity Income Fund Shares of Beneficial Interest,$18.44,-0.52,-2.743%,0.00,United States,2004,119090,Finance,Finance/Investors Services
EOS,Eaton Vance Enhance Equity Income Fund II Common Stock,$20.52,-0.84,-3.933%,0.00,,2005,178046,Finance,Trusts Except Educational Religious and Charitable
EOT,Eaton Vance Municipal Income Trust EATON VANCE NATIONAL MUNICIPAL OPPORTUNITIES TRUST,$16.74,-0.035,-0.209%,261561178.00,United States,2009,27012,Finance,Investment Bankers/Brokers/Service
EP^C,El Paso Corporation Preferred Stock,$48.60,-0.39,-0.796%,,United States,,1847,,
EPAC,Enerpac Tool Group Corp. Common Stock,$42.45,-3.62,-7.858%,2295904599.00,United States,,314552,Technology,Industrial Machinery/Components
EPAM,EPAM Systems Inc. Common Stock,$155.55,-13.51,-7.991%,8848948310.00,United States,2012,963040,Technology,EDP Services
EPC,Edgewell Personal Care Company Common Stock,$30.41,-1.29,-4.069%,1466633824.00,United States,,505448,Consumer Discretionary,Package Goods/Cosmetics
EPD,Enterprise Products Partners L.P. Common Stock,$33.47,-0.58,-1.703%,72485977728.00,United States,,7638010,Utilities,Natural Gas Distribution
